title,text,subject, date
Comelec to pilot mall voting for barangay polls in 15 sites,"The Commission on Elections (Comelec) is set to conduct the pilot test of mall voting for the 2023 Barangay and Sangguniang Kabataan Elections (BSKE) in 15 malls around the country.The selected malls are in Metro Manila, Region IV-A, Region V and Region VII, the poll body said.

“The Education and Information Department will provide the public of the details regarding the selected malls and other relevant data for mall voting once it has been finalized,” Comelec said in a statement Friday evening.“Through these efforts, voters from select clustered precincts of select barangays proximate to the partner malls shall participate in the mall voting,” it added.


In January, the Comelec said it will hold a pilot run of mall voting in five Metro Manila malls— SM Manila, Robinsons Manila, Robinsons Magnolia and two others. It cited the advantages of using malls as voting sites instead of classrooms, including security, prevention of sample ballots distribution, and the preservation of school equipment.",News,"June 9, 2023"
Comelec studying barangay polls postponement in Negros Oriental,"Public hearings will be conducted in Negros Oriental this month to see if there's a need to postpone the upcoming 2023 Barangay and Sangguniang Kabataan elections  in the light of the ""political violence"" in the province,  the Commission on Elections (Comelec) said Friday.In a statement, Comelec spokesperson Rex Laudiangco said this is to assess the current situation, particularly the peace and order status, and ""determine the sentiments of its constituents relative to the proposal to postpone the upcoming BSKE.""

During an earlier Senate inquiry into the killing of Negros Oriental Governor Roel Degamo, Senators Ronald ""Bato"" dela Rosa and Francis Tolentino asked the poll body to look into the possibility of holding off the elections amid the political violence in the province.",News,"June 9, 2023"
Comelec thumbs down Impact Hub's P15.3M claim due to lack of documents,"The Commission on Elections (Comelec) has denied the P15.3-million demand payment made by Impact Hub Manila, its official partner for the botched Eleksyon 2022 presidential and vice-presidential debates, due to lack of ""documentary requirements necessary to establish the validity of claim.""""Upon evaluation, Impact Hub's demand for payment is not accompanied by the documentary requirements necessary to establish the validity of claim,"" the Comelec said in a letter dated May 19, 2023 and signed by Executive Director Teofisto Elnas Jr.

""In this regard, the Commission is constrained to DENY Impact Hub's claim for P15,300,000,"" it added.",News,"May 23, 2023"
Impact Hub demands payment of P15M ‘debt’ from COMELEC despite botched debate in 2022,"Impact Hub Manila, the official partner of Commission on Elections (Comelec) for the Eleksyon 2022 presidential and vice-presidential debates, has made a “final demand” for the poll body to settle P15.3 million “unsettled liabilities” despite the cancellation of the third part of the debates.In a letter dated April 27, 2023, addressed to Comelec spokesperson Rex Laudiangco and signed by Impact Hub Manila’s lawyer, Ma. Karla Denise Frias, the debate contractor argued that even if the poll body “decided to unilaterally reschedule and eventually cancel the debates” the memorandum of agreement between the two parties still stands.

“Despite our client’s repeated demands, both verbally and via email, the claims remain unpaid. As such, please consider this as the FINAL DEMAND to coordinate and set a meeting with us to discuss the settlement of the outstanding balance,” the letter obtained by GMA News Online read.Impact Hub Manila warned that it will “avail legal remedies under the law to recover the debt and to protect the company’s interest” should Comelec fail to respond or to make a payment arrangement within the next five days upon the receipt of the notice.

Comelec Spokesperson Rex Laudiangco said the poll body’s Education and Information Department received a copy of the letter on May 8. But since he has no power or authority to act on it, the demand letter was referred to the Office of Comelec Chairman George Garcia, Executive Director Teofisto Elnas Jr., and their Law Department.",News,"May 15, 2023"
Sandro Marcos wants mail-in voting for elderly during state of calamity,"A bill allowing senior citizens, handicapped, sick as well as locally stranded individuals to cast their vote via mail during public health emergency or state of calamity has been filed in the House of Representatives.Senior Deputy Majority Leader Sandro Marcos of Ilocos Norte made the proposal under House Bill 8037 which tasks the Commission on Elections (Comelec) to adopt and implement a postal or mail-in voting system in times of public health emergencies or states of calamity for the benefit of senior citizens, the handicapped the sick and locally stranded individuals “who are duly registered voters and who, on election day, may not be able to vote due to high risk of infection or physical impossibility.”Marcos’ bill defines postal or mail-voting as a form of absentee voting in which a ballot is mailed to the home of a registered voter.

The recipient registered voter will then fill out the ballot and return it either by postal mail or drop it off in-person or by a representative into a secure drop box or at a voting center.",News,"May 15, 2023"
"Proposed automated election system for 2025 allows quick verification of ballots, ERs — Garcia","The Commission on Elections’ proposed automated election system (AES) for the 2025 polls will adopt mechanisms that will improve the transparency of the voting process in the country, Comelec Chairman George Garcia said Friday.Under Fully Automated System with Transparency Audit and Count (FASTrAC), Garcia said voters will be allowed to verify their votes through ballot images on automated counting machines while watchers and political camps will be allowed to take pictures of election returns after its transmission.

“Makikita ng botante ang balota na kanyang hinulog back and [front] yung mismong ballot image,” Garcia said in an interview  on Dobol B TV when asked about the new security features of the proposed AES.

For those who are visually impaired, Garcia said there is an audio feature where the machine can read the votes cast by the voter.

Apart from this, Garcia said citizens’ arms and political groups will automatically receive a copy of the election returns—a mechanism which he said was non-existent in the automated election system since it was implemented in 2010.",News,"May 5, 2023"
